{
  "schema_version": "0.1.0",
  "proposal_id": "PRP-CLM-000001",
  "object_type": "claim",
  "run_id": "RUN-TEST-001",
  "origin_group_ids": ["ORG-000001", "ORG-000002"],
  "has_primary_source": true,
  "artifact_id": "CLM-000001",
  "created_by_agent_id": "discovery-test-01",
  "created_at": "2026-08-23T00:00:00Z"
}
